[
  {
    "schema_version": "mining_block_nomenclature_grammar_fixture_v1",
    "data_class": "SYNTHETIC_ONLY",
    "case_id": "P01",
    "case_class": "POSITIVE",
    "raw_synthetic_string": "ZZSYN-QA-01",
    "normalized_tokens": ["ATOM:ZZSYN-QA-01"],
    "lexical_safety_status": "SAFE",
    "lexical_reason_code": "LEXICAL_OK",
    "normalization_status": "UNCHANGED",
    "normalization_reason_code": "NORMALIZATION_NOT_REQUIRED",
    "grammar_status": "PARSED",
    "grammar_reason_code": "GRAMMAR_OK",
    "interpretation_status": "UNRESOLVED",
    "interpretation_reason_code": "RULESET_UNKNOWN",
    "ruleset_status": "UNKNOWN_RULESET",
    "authority_failure_reason": "UNKNOWN_RULESET_NO_SPATIAL_AUTHORITY",
    "partial_assertions_required": false,
    "partial_assertions": null,
    "spatial_expectations": { "geometry_expected": false, "crs_expected": false, "bounds_expected": false, "adjacency_expected": false, "area_expected": false, "legal_boundary_expected": false, "resolver_success_expected": false, "finalizer_auto_export_expected": false, "map_authority_expected": false, "kml_export_expected": false, "kmz_export_expected": false },
    "spatial_authority_expected": false
  },
  {
    "schema_version": "mining_block_nomenclature_grammar_fixture_v1",
    "data_class": "SYNTHETIC_ONLY",
    "case_id": "P02",
    "case_class": "POSITIVE",
    "raw_synthetic_string": "ZZSYN-QA-01,ZZSYN-QB-02",
    "normalized_tokens": ["ATOM:ZZSYN-QA-01", "LIST_SEPARATOR:,", "ATOM:ZZSYN-QB-02"],
    "lexical_safety_status": "SAFE",
    "lexical_reason_code": "LEXICAL_OK",
    "normalization_status": "UNCHANGED",
    "normalization_reason_code": "NORMALIZATION_NOT_REQUIRED",
    "grammar_status": "PARSED",
    "grammar_reason_code": "GRAMMAR_OK",
    "interpretation_status": "UNRESOLVED",
    "interpretation_reason_code": "RULESET_UNKNOWN",
    "ruleset_status": "UNKNOWN_RULESET",
    "authority_failure_reason": "UNKNOWN_RULESET_NO_SPATIAL_AUTHORITY",
    "partial_assertions_required": false,
    "partial_assertions": null,
    "spatial_expectations": { "geometry_expected": false, "crs_expected": false, "bounds_expected": false, "adjacency_expected": false, "area_expected": false, "legal_boundary_expected": false, "resolver_success_expected": false, "finalizer_auto_export_expected": false, "map_authority_expected": false, "kml_export_expected": false, "kmz_export_expected": false },
    "spatial_authority_expected": false
  },
  {
    "schema_version": "mining_block_nomenclature_grammar_fixture_v1",
    "data_class": "SYNTHETIC_ONLY",
    "case_id": "P03",
    "case_class": "POSITIVE",
    "raw_synthetic_string": "ZZSYN-QA-01..ZZSYN-QA-03",
    "normalized_tokens": ["ATOM:ZZSYN-QA-01", "RANGE_OPERATOR:..", "ATOM:ZZSYN-QA-03"],
    "lexical_safety_status": "SAFE",
    "lexical_reason_code": "LEXICAL_OK",
    "normalization_status": "UNCHANGED",
    "normalization_reason_code": "NORMALIZATION_NOT_REQUIRED",
    "grammar_status": "PARSED",
    "grammar_reason_code": "GRAMMAR_OK",
    "interpretation_status": "UNRESOLVED",
    "interpretation_reason_code": "RANGE_SEMANTICS_UNKNOWN",
    "ruleset_status": "UNKNOWN_RULESET",
    "authority_failure_reason": "UNKNOWN_RULESET_NO_SPATIAL_AUTHORITY",
    "partial_assertions_required": false,
    "partial_assertions": null,
    "spatial_expectations": { "geometry_expected": false, "crs_expected": false, "bounds_expected": false, "adjacency_expected": false, "area_expected": false, "legal_boundary_expected": false, "resolver_success_expected": false, "finalizer_auto_export_expected": false, "map_authority_expected": false, "kml_export_expected": false, "kmz_export_expected": false },
    "spatial_authority_expected": false
  },
  {
    "schema_version": "mining_block_nomenclature_grammar_fixture_v1",
    "data_class": "SYNTHETIC_ONLY",
    "case_id": "P04",
    "case_class": "POSITIVE",
    "raw_synthetic_string": "ZZSYN-QA-01,ZZSYN-QB-02..ZZSYN-QB-04",
    "normalized_tokens": ["ATOM:ZZSYN-QA-01", "LIST_SEPARATOR:,", "ATOM:ZZSYN-QB-02", "RANGE_OPERATOR:..", "ATOM:ZZSYN-QB-04"],
    "lexical_safety_status": "SAFE",
    "lexical_reason_code": "LEXICAL_OK",
    "normalization_status": "UNCHANGED",
    "normalization_reason_code": "NORMALIZATION_NOT_REQUIRED",
    "grammar_status": "PARSED",
    "grammar_reason_code": "GRAMMAR_OK",
    "interpretation_status": "UNRESOLVED",
    "interpretation_reason_code": "RANGE_SEMANTICS_UNKNOWN",
    "ruleset_status": "UNKNOWN_RULESET",
    "authority_failure_reason": "UNKNOWN_RULESET_NO_SPATIAL_AUTHORITY",
    "partial_assertions_required": false,
    "partial_assertions": null,
    "spatial_expectations": { "geometry_expected": false, "crs_expected": false, "bounds_expected": false, "adjacency_expected": false, "area_expected": false, "legal_boundary_expected": false, "resolver_success_expected": false, "finalizer_auto_export_expected": false, "map_authority_expected": false, "kml_export_expected": false, "kmz_export_expected": false },
    "spatial_authority_expected": false
  },
  {
    "schema_version": "mining_block_nomenclature_grammar_fixture_v1",
    "data_class": "SYNTHETIC_ONLY",
    "case_id": "P05",
    "case_class": "POSITIVE",
    "raw_synthetic_string": "zzsyn-qa-05",
    "normalized_tokens": ["ATOM:ZZSYN-QA-05"],
    "lexical_safety_status": "SAFE",
    "lexical_reason_code": "LEXICAL_OK",
    "normalization_status": "NORMALIZED",
    "normalization_reason_code": "NORMALIZATION_APPLIED",
    "grammar_status": "PARSED",
    "grammar_reason_code": "GRAMMAR_OK",
    "interpretation_status": "UNRESOLVED",
    "interpretation_reason_code": "RULESET_UNKNOWN",
    "ruleset_status": "UNKNOWN_RULESET",
    "authority_failure_reason": "UNKNOWN_RULESET_NO_SPATIAL_AUTHORITY",
    "partial_assertions_required": false,
    "partial_assertions": null,
    "spatial_expectations": { "geometry_expected": false, "crs_expected": false, "bounds_expected": false, "adjacency_expected": false, "area_expected": false, "legal_boundary_expected": false, "resolver_success_expected": false, "finalizer_auto_export_expected": false, "map_authority_expected": false, "kml_export_expected": false, "kmz_export_expected": false },
    "spatial_authority_expected": false
  },
  {
    "schema_version": "mining_block_nomenclature_grammar_fixture_v1",
    "data_class": "SYNTHETIC_ONLY",
    "case_id": "P06",
    "case_class": "POSITIVE",
    "raw_synthetic_string": "  ZZSYN – QA – 06  ",
    "normalized_tokens": ["ATOM:ZZSYN-QA-06"],
    "lexical_safety_status": "SAFE",
    "lexical_reason_code": "LEXICAL_OK",
    "normalization_status": "NORMALIZED",
    "normalization_reason_code": "NORMALIZATION_APPLIED",
    "grammar_status": "PARSED",
    "grammar_reason_code": "GRAMMAR_OK",
    "interpretation_status": "UNRESOLVED",
    "interpretation_reason_code": "RULESET_UNKNOWN",
    "ruleset_status": "UNKNOWN_RULESET",
    "authority_failure_reason": "UNKNOWN_RULESET_NO_SPATIAL_AUTHORITY",
    "partial_assertions_required": false,
    "partial_assertions": null,
    "spatial_expectations": { "geometry_expected": false, "crs_expected": false, "bounds_expected": false, "adjacency_expected": false, "area_expected": false, "legal_boundary_expected": false, "resolver_success_expected": false, "finalizer_auto_export_expected": false, "map_authority_expected": false, "kml_export_expected": false, "kmz_export_expected": false },
    "spatial_authority_expected": false
  },
  {
    "schema_version": "mining_block_nomenclature_grammar_fixture_v1",
    "data_class": "SYNTHETIC_ONLY",
    "case_id": "P07",
    "case_class": "POSITIVE",
    "raw_synthetic_string": "ZZSYN-QA-07,ZZSYN-QA-07",
    "normalized_tokens": ["ATOM:ZZSYN-QA-07", "LIST_SEPARATOR:,", "ATOM:ZZSYN-QA-07"],
    "lexical_safety_status": "SAFE",
    "lexical_reason_code": "LEXICAL_OK",
    "normalization_status": "UNCHANGED",
    "normalization_reason_code": "NORMALIZATION_NOT_REQUIRED",
    "grammar_status": "PARSED",
    "grammar_reason_code": "GRAMMAR_OK",
    "interpretation_status": "UNRESOLVED",
    "interpretation_reason_code": "RULESET_UNKNOWN",
    "ruleset_status": "UNKNOWN_RULESET",
    "authority_failure_reason": "UNKNOWN_RULESET_NO_SPATIAL_AUTHORITY",
    "partial_assertions_required": false,
    "partial_assertions": null,
    "spatial_expectations": { "geometry_expected": false, "crs_expected": false, "bounds_expected": false, "adjacency_expected": false, "area_expected": false, "legal_boundary_expected": false, "resolver_success_expected": false, "finalizer_auto_export_expected": false, "map_authority_expected": false, "kml_export_expected": false, "kmz_export_expected": false },
    "spatial_authority_expected": false
  },
  {
    "schema_version": "mining_block_nomenclature_grammar_fixture_v1",
    "data_class": "SYNTHETIC_ONLY",
    "case_id": "P08",
    "case_class": "POSITIVE",
    "raw_synthetic_string": "ZZSYN-QA-09,ZZSYN-QA-02",
    "normalized_tokens": ["ATOM:ZZSYN-QA-09", "LIST_SEPARATOR:,", "ATOM:ZZSYN-QA-02"],
    "lexical_safety_status": "SAFE",
    "lexical_reason_code": "LEXICAL_OK",
    "normalization_status": "UNCHANGED",
    "normalization_reason_code": "NORMALIZATION_NOT_REQUIRED",
    "grammar_status": "PARSED",
    "grammar_reason_code": "GRAMMAR_OK",
    "interpretation_status": "UNRESOLVED",
    "interpretation_reason_code": "RULESET_UNKNOWN",
    "ruleset_status": "UNKNOWN_RULESET",
    "authority_failure_reason": "UNKNOWN_RULESET_NO_SPATIAL_AUTHORITY",
    "partial_assertions_required": false,
    "partial_assertions": null,
    "spatial_expectations": { "geometry_expected": false, "crs_expected": false, "bounds_expected": false, "adjacency_expected": false, "area_expected": false, "legal_boundary_expected": false, "resolver_success_expected": false, "finalizer_auto_export_expected": false, "map_authority_expected": false, "kml_export_expected": false, "kmz_export_expected": false },
    "spatial_authority_expected": false
  },
  {